filename,notes,authors,licenses,urls
"body/bodies/male/walk.png","see details at https://opengameart.org/content/lpc-character-bases; 'Thick' Male Revised Run/Climb by JaidynReiman (based on ElizaWy's LPC Revised)","bluecarrot16, JaidynReiman, Benjamin K. Smith (BenCreating), Evert, Eliza Wyatt (ElizaWy), TheraHedwig, MuffinElZangano, Durrani, Johannes Sjölund (wulax), Stephen Challener (Redshrike)","OGA-BY 3.0, CC-BY-SA 3.0, GPL 3.0","https://opengameart.org/content/liberated-pixel-cup-lpc-base-assets-sprites-map-tiles, https://opengameart.org/content/lpc-medieval-fantasy-character-sprites, https://opengameart.org/content/lpc-male-jumping-animation-by-durrani, https://opengameart.org/content/lpc-runcycle-and-diagonal-walkcycle, https://opengameart.org/content/lpc-revised-character-basics, https://opengameart.org/content/lpc-be-seated, https://opengameart.org/content/lpc-runcycle-for-male-muscular-and-pregnant-character-bases-with-modular-heads, https://opengameart.org/content/lpc-jump-expanded, https://opengameart.org/content/lpc-character-bases"
"head/heads/human/male/walk.png","original head by Redshrike, tweaks by BenCreating, modular version by bluecarrot16","bluecarrot16, Benjamin K. Smith (BenCreating), Stephen Challener (Redshrike)","OGA-BY 3.0, CC-BY-SA 3.0, GPL 3.0","https://opengameart.org/content/liberated-pixel-cup-lpc-base-assets-sprites-map-tiles, https://opengameart.org/content/lpc-character-bases"
"hair/balding/adult/walk/chestnut.png","","ElizaWy","OGA-BY 3.0","https://opengameart.org/content/lpc-hair"
"torso/clothes/sleeveless/sleeveless2/male/walk.png","original by ElizaWy; sleeveless adapted from original by JaidynReiman","ElizaWy, JaidynReiman, Stephen Challener (Redshrike), Johannes Sjölund (wulax)","OGA-BY 3.0","http://opengameart.org/content/lpc-revised-character-basics, https://github.com/ElizaWy/LPC/tree/main/Characters/Clothing, https://opengameart.org/content/lpc-expanded-sit-run-jump-more, https://opengameart.org/content/lpc-expanded-simple-shirts"
"legs/pants/male/walk.png","original male pants by wulax, recolors and edits to v3 base by bluecarrot16, climb/jump/run/sit/emotes/revised combat by JaidynReiman based on ElizaWy's LPC Revised","bluecarrot16, JaidynReiman, ElizaWy, Matthew Krohn (makrohn), Johannes Sjölund (wulax), Stephen Challener (Redshrike)","OGA-BY 3.0, GPL 3.0, CC-BY-SA 3.0","https://opengameart.org/content/liberated-pixel-cup-lpc-base-assets-sprites-map-tiles, https://opengameart.org/content/lpc-medieval-fantasy-character-sprites, https://opengameart.org/content/lpc-expanded-pants"
"feet/boots/basic/male/walk/brown.png","original by Nila122, edited for male and v3 bases by bluecarrot16, Jump/Sit/Emote/Run/Revised Combat by JaidynReiman","JaidynReiman, bluecarrot16, Nila122","OGA-BY 3.0, CC-BY-SA 3.0, GPL 2.0, GPL 3.0","https://opengameart.org/content/lpc-clothes-and-hair, https://opengameart.org/content/lpc-expanded-socks-shoes"
"torso/waist/belt_leather/male/walk/leather.png","","bluecarrot16, Johannes Sjölund (wulax), Matthew Krohn (makrohn)","OGA-BY 3.0, CC-BY-SA 3.0, GPL 3.0","https://opengameart.org/content/lpc-combat-armor-for-women, https://opengameart.org/content/lpc-pirates"
"beards/beard/5oclock_shadow/walk/white.png","Original by Pennomi, repositioning by JaidynReiman.","JaidynReiman, Thane Brimhall (pennomi), laetissima","CC-BY-SA 3.0, GPL 3.0","https://opengameart.org/content/lpc-base-character-expressions"
